title,units,description
BOT 105 - General Botany,4,"Structure, function, reproduction, life cycles, and phylogenetic relationships of major plant groups. Relationships of plants to other organisms and to human activities."
CHEM 107 - Fundamentals of Chemistry,4,Terminal course. Fundamental concepts and applications of general and inorganic chemistry.
ESM 105 - Natural Resource Conservation,3,Broad aspects; history of humanity in relation to land use; human populations in relation to resources; history of conservation movement; present day conservation problems.
FOR 130 - Dendrology,3,"US trees/shrubs. Ranges, botanical characteristics, commercial and noncommercial uses, growth rates, and relation of plants to their total environment. Identify under field conditions and using herbarium specimens."
FOR 131 - Forest Ecology,3,"Ecological principles applied to forest management. Production ecology, biogeochemistry, disturbances, environmental factors, populations, community ecology, forest succession, and forest classification/description."
FOR 210 - Forest Measurements and Biometry,4,"Surveying including angle and distance measurement, leveling and traverse. Public land survey. Topographic map reading and construction. Tree and forest measurements under field conditions. Forest sampling theory. Introductory statistical analysis of forest measurements."
FOR 222 - Forest Health and Protection,2,Biotic and abiotic disturbance agents. Identification and ecology of important forest insects and diseases of North America. Predisposing factors that increase susceptibility of forests. Management strategies to reduce impacts.
FIRE 123 - Fundamentals of Fuel and Fire,2,"An introduction to the science, ecology, and management of fuels and fire. Current issues and management options to reduce the negative impacts of wildfire."
FOR 250 - Introduction to Forest Operations,3,Overview of forest operations and environmental issues associated with today’s forest management practices. Use of mechanized equipment as a tool to meet various forest management objectives.
GSP 101 - Geospatial Concepts,3,"Overview: scale, coordinates, geodesy, direction, projections, surveying, global positioning systems (GPS), remote sensing, geographic information systems (GIS), cartography; historical context illustrating how maps depict spatial relationships, chart power, convey authority."
SOIL 260 - Introduction to Soil Science,3,"Soil’s physical, chemical, and biological properties. Implications for land management. Identify soil parent materials; use soil survey reports."
STAT 108 - Elementary Statistics,3,"Rudimentary data collection, descriptive statistics of univariate and bivariate data, probability, random variables, discrete and continuous distributions. Foundational concepts of confidence intervals and hypothesis tests. Use and abuse of statistics."
STAT 108I - Elementary Statistics with Integrated Support,3,"Introductory statistics with integrated support to aid comprehension. Data collection, descriptive statistics, bivariate data, probability, probability distributions. Foundational concepts of confidence intervals and hypothesis tests. Use and abuse of statistics. Open to students in Math placement category III or IV."
ESM 305 - Environmental Conflict Resolution,3,"Introduction to conflict theory as applied in complex natural resource disputes. Skill development in planning culturally appropriate and inclusive public participation processes, meeting facilitation, and conflict mediation. Comparison of options for nonviolent conflict management."
FOR 311 - Forest Mensuration and Growth,4,"Sampling techniques in forest inventory, timber cruising, and site index determination. Develop volume tables and predict stand growth. Use growth models and computer applications."
FOR 331 - Silvics - Foundation of Silviculture,3,"Woody plant interaction with environmental stresses. Factors influencing vigor and growth. Changes to stand structure caused by humans (thinning, harvesting, fertilization), nature (wind, soil, climate) or time. Selection using genetic principles for improved growth. Seedling production methods in stock types in relation to their effect on morphology/survival."
FOR 365 - Forest Economics and Finance,3,"Capital budgeting; benefit/cost analysis; forest appraisal and taxation; welfare economics, management decision making; uncertainty and risk."
FOR 432 - Silviculture,4,"Theory and practice of controlling forest establishment, composition, and growth. Fundamentals of forest stand development and dynamics. Forest stewardship techniques to satisfy a range of possible objectives (biological, economic, and social)."
FOR 359 - Forest and Rangeland Policy,3,US and California government and policies are introduced with an emphasis on the interactions between these institutions and natural resource management. Regulations are analyzed from creation to implementation and interpretation. Meets requirement in “US Constitution and California State and Local Government” established by CA legislature.
FOR 479W - Forestry Capstone,3,"A forestry-related project, produced either by a team or by an individual, culminating in a public presentation."
WSHD 310 - Hydrology and Watershed Management,4,"Hydrologic considerations of forest roads, stream crossings, road drainage. Management influences on hydrologic processes and aquatic habitat; protecting salmonid resources."
GSP 216 - Introduction to Remote Sensing,3,"Introductory course in remote sensing focusing on broad topics pertaining to nature of radiation, aerial photography and interpretation, multispectral scanners, and image data and processing."
GSP 270 - Geographic Information Science (GIS),3,"Introductory course in Geographic Information Science and spatial analysis involving collection, manipulation, display, and analysis of geographically referenced data. Raster and Vector data, overlays, buffer, proximity analysis and SQL queries."
FISH 300 - Introduction to Fishery Biology,3,"Identification, life histories, and ecology of important freshwater and marine fishes. Principles of fisheries management and its relationships with management of other resources."
RRS 306 - Rangeland Management Principles,3,Analysis of rangeland biophysical communities; management for sustainable human and environmental values; use by wild and domestic animals; historical and legal changes in rangeland management.
FOR 350 - Forest Harvesting Systems,3,"Machine operations in ground-based systems, rigging requirements and payload analysis in skyline yarding, helicopter yarding, harvesting planning and unit layout, optimization in transportation planning."
FOR 353 - Forest Road Location and Design,3,"Road design procedures, standards, and techniques for forest management. Reconnaissance, route surveying, office and field design and location, geometrics, drainage systems, soil engineering, construction sequencing and techniques, erosion control, maintenance."
FOR 450 - Harvesting Systems Design and Cost Analysis,3,"Designing integrative harvesting and transportation systems. Computer applications in harvesting cost analysis, equipment purchase and replacement, break-even/sensitivity analysis, statistical analyses and operations research techniques applied to forest operations."
FOR 471 - Forest Administration and Ethics,3,"Policy making; administrative behavior; legislative, regulatory, legal, and ethical considerations as applied to forest management."
FOR 475 - Forest Management Decision Making,3,"Social, political, economic, ecological, and silvicultural principles relating to contemporary forestry decision making processes. Predicting forest outcomes, tactical and strategic forest planning sustainability, risk assessment, monitoring and adaptive management."
FOR 476 - Advanced Forest Management,2,"In discussion with land management professionals, students will develop projects on contemporary issues in forest disturbance-based management such as resilience amid a changing climate and management for ecosystem services."
FIRE 324 - Fuel Inventory and Management,3,"Monitoring and managing wildland fuels in forests and rangelands. Advanced understanding of fuel dynamics, management strategies, and challenges facing fuels managers in fire-prone landscapes. Quantitative analysis of the effects of fuels treatments."
FOR 431 - Forest Restoration,3,"Forest restoration at multiple spatial scales from stand to landscape level. Goals for biological conservation, carbon sequestration, economic viability. Restoration techniques and case studies. Managing invasive plant species."
WSHD 458 - Climate Change and Land Use,3,"Implications of climate change for terrestrial and aquatic resources. Overview of projected shifts in weather and climate. Influence of land use decisions on global carbon cycle in forests, agriculture and wetlands."
